{"$schema":"https://json-schema.org/draft/2020-12/schema","type":"object","required":["schema","authority","initial","count","identities"],"properties":{"schema":{"const":"character-identity-shard.v1"},"authority":{"const":true},"initial":{"type":"string","minLength":1,"maxLength":1},"count":{"type":"integer","minimum":0},"identities":{"type":"object","additionalProperties":{"type":"object","required":["name","routing_hints"],"additionalProperties":false,"properties":{"name":{"type":"string","minLength":1},"routing_hints":{"type":"object","additionalProperties":false,"properties":{"source_owner_hint":{"type":"string"},"unresolved_route":{"type":"boolean"},"state_or_affiliation_hint":{"type":"string"},"role_template_hint":{"type":"string"},"profile_seed":{"type":"string"},"activity_owner_hint":{"type":"string"},"location_hint":{"type":"string"},"source_unit_hint":{"type":"string"}}}}}}},"additionalProperties":false}
