{"schema":"character-identity-shard.v1","authority":true,"initial":"a","count":6,"identities":{"char_a_ka_kin":{"name":"A Ka Kin","routing_hints":{"role_template_hint":"unresolved_until_activation","profile_seed":"215de3970fe65303","activity_owner_hint":"process_canon_background_unresolved","location_hint":"unit_bound","unresolved_route":true}},"char_a_kou":{"name":"A Kou","routing_hints":{"role_template_hint":"unresolved_until_activation","profile_seed":"aade73a0dddeb892","activity_owner_hint":"process_canon_background_unresolved","location_hint":"unit_bound","unresolved_route":true}},"char_a_min":{"name":"A Min","routing_hints":{"role_template_hint":"unresolved_until_activation","profile_seed":"3ff1a516e3b9a9e6","activity_owner_hint":"process_canon_background_unresolved","location_hint":"unit_bound","unresolved_route":true}},"char_a_mon":{"name":"A Mon","routing_hints":{"role_template_hint":"unresolved_until_activation","profile_seed":"d4dcf10ab5ffc2dd","activity_owner_hint":"process_canon_background_unresolved","location_hint":"unit_bound","unresolved_route":true}},"char_ai_sen":{"name":"Ai Sen","routing_hints":{"role_template_hint":"unresolved_until_activation","profile_seed":"5a128de474ae62df","activity_owner_hint":"process_canon_background_unresolved","location_hint":"unit_bound","unresolved_route":true}},"char_an_ri":{"name":"An Ri","routing_hints":{"role_template_hint":"unresolved_until_activation","profile_seed":"0c7dc0181c27fcac","activity_owner_hint":"process_canon_background_unresolved","location_hint":"unit_bound","unresolved_route":true}}}}
